{
  "$schema": "https://json-schema.org/draft/2020-12/schema",
  "title": "EvaluationReport",
  "description": "후보 모델 하나(역할 하나)의 평가 결과를 지표 체계(METRICS.md)로 낸 보고서. 합격 여부나 임계치는 담지 않는다. 출고는 학습 담당자가 이 보고서를 보고 사람이 정한다(D53).",
  "type": "object",
  "additionalProperties": false,
  "required": [
    "pipeline_schema_version",
    "report_id",
    "created_at",
    "role",
    "package",
    "evaluation_backend",
    "decoding",
    "metrics",
    "content_hash"
  ],
  "properties": {
    "pipeline_schema_version": {
      "$ref": "_common.schema.json#/$defs/PipelineSchemaVersion"
    },
    "report_id": {
      "$ref": "_common.schema.json#/$defs/Id"
    },
    "created_at": {
      "$ref": "_common.schema.json#/$defs/Timestamp"
    },
    "role": {
      "enum": [
        "LORA_A",
        "LORA_B"
      ]
    },
    "package": {
      "$ref": "_common.schema.json#/$defs/ArtifactRef"
    },
    "dataset": {
      "$ref": "_common.schema.json#/$defs/ArtifactRef"
    },
    "question_sets": {
      "type": "array",
      "items": {
        "$ref": "_common.schema.json#/$defs/ArtifactRef"
      }
    },
    "evaluation_backend": {
      "type": "object",
      "additionalProperties": false,
      "required": [
        "name",
        "version"
      ],
      "properties": {
        "name": {
          "type": "string",
          "minLength": 1
        },
        "version": {
          "type": "string",
          "minLength": 1
        },
        "constrained_decoding": {
          "type": "boolean"
        }
      }
    },
    "decoding": {
      "type": "object",
      "additionalProperties": false,
      "required": [
        "temperature"
      ],
      "properties": {
        "temperature": {
          "type": "number",
          "minimum": 0
        },
        "seed": {
          "type": "integer"
        }
      }
    },
    "metrics": {
      "type": "array",
      "minItems": 1,
      "items": {
        "type": "object",
        "additionalProperties": false,
        "required": [
          "name",
          "group",
          "value",
          "n",
          "higher_is_better"
        ],
        "properties": {
          "name": {
            "type": "string",
            "minLength": 1,
            "description": "METRICS.md의 지표 이름"
          },
          "group": {
            "enum": [
              "SAFETY",
              "ACCURACY",
              "PROTECTION",
              "ROBUSTNESS",
              "COVERAGE",
              "REGRESSION",
              "OTHER"
            ],
            "description": "SAFETY는 보고서 맨 위에 따로 보인다. 모르는 값은 OTHER로 취급한다"
          },
          "slice": {
            "title": "MetricSlice",
            "description": "지표를 계산한 부분집합. kind는 ALL, QUESTION_SET, SEEN_UNSEEN, INTENT, QUESTION_TYPE, UNIT, RANGE, NOISE, SCENARIO 등이고 값은 문자열이다. 모르는 kind는 그대로 보여 주기만 한다.",
            "type": "object",
            "additionalProperties": false,
            "required": [
              "kind",
              "value"
            ],
            "properties": {
              "kind": {
                "type": "string",
                "minLength": 1
              },
              "value": {
                "type": "string",
                "minLength": 1
              }
            }
          },
          "value": {
            "type": "number"
          },
          "n": {
            "type": "integer",
            "minimum": 0,
            "description": "이 값을 계산한 표본 수. 0이면 계산하지 못했다는 뜻이고 value를 믿지 않는다"
          },
          "higher_is_better": {
            "type": "boolean"
          },
          "unit": {
            "enum": [
              "ratio",
              "count",
              "ms",
              "score"
            ]
          }
        }
      }
    },
    "notes": {
      "type": "array",
      "items": {
        "type": "string"
      }
    },
    "content_hash": {
      "$ref": "_common.schema.json#/$defs/Hash"
    },
    "ext": {
      "type": "object",
      "description": "영역이 계약을 바꾸지 않고 덧붙이는 부가 정보. 키는 영역 이름(예: 'model-lab')이고 값은 그 영역이 정한다. 다른 영역은 이해하지 못해도 보존하고 전달해야 하며, 판단에 쓰지 않는다. 여러 영역이 필요로 하게 되면 정식 필드로 올린다."
    }
  }
}
